{"version":"v1","license":"CC BY 4.0","id":"best-of-ai","title":"Best of Open-Source AI","page":"https://archestack.com/best-of-ai/","updated":"2026-10-15","categories":[{"id":"assistants","title":"Assistants","url":"https://archestack.com/api/v1/categories/best-of-ai/assistants.json","top":[{"id":"best-of-ai/openclaw","name":"OpenClaw","url":"https://archestack.com/api/v1/projects/best-of-ai/openclaw.json","page":"https://archestack.com/best-of-ai/projects/openclaw/","place":1,"score":85,"tagline":"Personal assistant gateway that answers in Discord, Slack, WhatsApp and Telegram","source_url":"https://archestack.com/best-of-ai/projects/openclaw/","checked_at":"2026-10-15"},{"id":"best-of-ai/nanobot","name":"nanobot","url":"https://archestack.com/api/v1/projects/best-of-ai/nanobot.json","page":"https://archestack.com/best-of-ai/projects/nanobot/","place":2,"score":82,"tagline":"Self-hosted Python personal agent with WebUI, TUI and chat-app channels","source_url":"https://archestack.com/best-of-ai/projects/nanobot/","checked_at":"2026-10-15"},{"id":"best-of-ai/openhuman","name":"openhuman","url":"https://archestack.com/api/v1/projects/best-of-ai/openhuman.json","page":"https://archestack.com/best-of-ai/projects/openhuman/","place":3,"score":81,"tagline":"Rust agent harness with desktop app, built-in memory and embeddable library","source_url":"https://archestack.com/best-of-ai/projects/openhuman/","checked_at":"2026-10-15"},{"id":"best-of-ai/hermes-agent","name":"Hermes Agent","url":"https://archestack.com/api/v1/projects/best-of-ai/hermes-agent.json","page":"https://archestack.com/best-of-ai/projects/hermes-agent/","place":4,"score":76,"tagline":"Terminal and chat-app agent that writes its own skills and remembers you","source_url":"https://archestack.com/best-of-ai/projects/hermes-agent/","checked_at":"2026-10-15"},{"id":"best-of-ai/career-ops","name":"career-ops","url":"https://archestack.com/api/v1/projects/best-of-ai/career-ops.json","page":"https://archestack.com/best-of-ai/projects/career-ops/","place":5,"score":76,"tagline":"Job-search agent that scores postings against your CV and drafts applications","source_url":"https://archestack.com/best-of-ai/projects/career-ops/","checked_at":"2026-10-15"}]},{"id":"chat-ui","title":"Chat UIs","url":"https://archestack.com/api/v1/categories/best-of-ai/chat-ui.json","top":[{"id":"best-of-ai/lobehub","name":"LobeHub","url":"https://archestack.com/api/v1/projects/best-of-ai/lobehub.json","page":"https://archestack.com/best-of-ai/projects/lobehub/","place":1,"score":84,"tagline":"Agent workspace with builder, groups, scheduling and 10,000+ MCP skills","source_url":"https://archestack.com/best-of-ai/projects/lobehub/","checked_at":"2026-10-15"},{"id":"best-of-ai/open-webui","name":"Open WebUI","url":"https://archestack.com/api/v1/projects/best-of-ai/open-webui.json","page":"https://archestack.com/best-of-ai/projects/open-webui/","place":2,"score":82,"tagline":"Self-hosted chat UI for Ollama and OpenAI-compatible APIs with RBAC and RAG","source_url":"https://archestack.com/best-of-ai/projects/open-webui/","checked_at":"2026-10-15"},{"id":"best-of-ai/anything-llm","name":"AnythingLLM","url":"https://archestack.com/api/v1/projects/best-of-ai/anything-llm.json","page":"https://archestack.com/best-of-ai/projects/anything-llm/","place":3,"score":81,"tagline":"Document chat and agent app with built-in RAG, MCP and multi-user support","source_url":"https://archestack.com/best-of-ai/projects/anything-llm/","checked_at":"2026-10-15"},{"id":"best-of-ai/onyx","name":"Onyx","url":"https://archestack.com/api/v1/projects/best-of-ai/onyx.json","page":"https://archestack.com/best-of-ai/projects/onyx/","place":4,"score":69,"tagline":"Team knowledge chat that indexes 50+ apps for RAG and agents","source_url":"https://archestack.com/best-of-ai/projects/onyx/","checked_at":"2026-10-15"},{"id":"best-of-ai/big-agi","name":"big-AGI","url":"https://archestack.com/api/v1/projects/best-of-ai/big-agi.json","page":"https://archestack.com/best-of-ai/projects/big-agi/","place":5,"score":69,"tagline":"Multi-model chat workspace with Beam side-by-side model comparison","source_url":"https://archestack.com/best-of-ai/projects/big-agi/","checked_at":"2026-10-15"}]},{"id":"desktop-apps","title":"Desktop AI apps","url":"https://archestack.com/api/v1/categories/best-of-ai/desktop-apps.json","top":[{"id":"best-of-ai/cherry-studio","name":"cherry-studio","url":"https://archestack.com/api/v1/projects/best-of-ai/cherry-studio.json","page":"https://archestack.com/best-of-ai/projects/cherry-studio/","place":1,"score":77,"tagline":"Cross-platform desktop chat client for many cloud and local LLM providers","source_url":"https://archestack.com/best-of-ai/projects/cherry-studio/","checked_at":"2026-10-15"},{"id":"best-of-ai/deep-live-cam","name":"deep-live-cam","url":"https://archestack.com/api/v1/projects/best-of-ai/deep-live-cam.json","page":"https://archestack.com/best-of-ai/projects/deep-live-cam/","place":2,"score":75,"tagline":"Real-time webcam face swap from a single source image","source_url":"https://archestack.com/best-of-ai/projects/deep-live-cam/","checked_at":"2026-10-15"},{"id":"best-of-ai/prompt-optimizer","name":"prompt-optimizer","url":"https://archestack.com/api/v1/projects/best-of-ai/prompt-optimizer.json","page":"https://archestack.com/best-of-ai/projects/prompt-optimizer/","place":3,"score":74,"tagline":"Prompt rewriting and testing tool for web, desktop, Chrome and MCP","source_url":"https://archestack.com/best-of-ai/projects/prompt-optimizer/","checked_at":"2026-10-15"},{"id":"best-of-ai/jan","name":"jan","url":"https://archestack.com/api/v1/projects/best-of-ai/jan.json","page":"https://archestack.com/best-of-ai/projects/jan/","place":4,"score":68,"tagline":"Desktop app that runs local models or cloud APIs, with a local server","source_url":"https://archestack.com/best-of-ai/projects/jan/","checked_at":"2026-10-15"},{"id":"best-of-ai/chatbox","name":"chatbox","url":"https://archestack.com/api/v1/projects/best-of-ai/chatbox.json","page":"https://archestack.com/best-of-ai/projects/chatbox/","place":5,"score":65,"tagline":"Desktop and mobile chat client for OpenAI, Claude, Gemini and Ollama models","source_url":"https://archestack.com/best-of-ai/projects/chatbox/","checked_at":"2026-10-15"}]},{"id":"agent-platforms","title":"Agent platforms","url":"https://archestack.com/api/v1/categories/best-of-ai/agent-platforms.json","top":[{"id":"best-of-ai/langflow","name":"Langflow","url":"https://archestack.com/api/v1/projects/best-of-ai/langflow.json","page":"https://archestack.com/best-of-ai/projects/langflow/","place":1,"score":80,"tagline":"Visual builder for AI agents and workflows, exposed as API or MCP server","source_url":"https://archestack.com/best-of-ai/projects/langflow/","checked_at":"2026-10-15"},{"id":"best-of-ai/daily-stock-analysis","name":"daily_stock_analysis","url":"https://archestack.com/api/v1/projects/best-of-ai/daily-stock-analysis.json","page":"https://archestack.com/best-of-ai/projects/daily-stock-analysis/","place":2,"score":77,"tagline":"Daily LLM stock analysis for A-share, HK, US and other markets, pushed to chat apps","source_url":"https://archestack.com/best-of-ai/projects/daily-stock-analysis/","checked_at":"2026-10-15"},{"id":"best-of-ai/deer-flow","name":"deer-flow","url":"https://archestack.com/api/v1/projects/best-of-ai/deer-flow.json","page":"https://archestack.com/best-of-ai/projects/deer-flow/","place":3,"score":75,"tagline":"Agent harness that runs sub-agents, memory and sandboxed skills for long tasks","source_url":"https://archestack.com/best-of-ai/projects/deer-flow/","checked_at":"2026-10-15"},{"id":"best-of-ai/dify","name":"Dify","url":"https://archestack.com/api/v1/projects/best-of-ai/dify.json","page":"https://archestack.com/best-of-ai/projects/dify/","place":4,"score":74,"tagline":"Visual builder for LLM workflows, RAG pipelines and agents, with APIs","source_url":"https://archestack.com/best-of-ai/projects/dify/","checked_at":"2026-10-15"},{"id":"best-of-ai/multica","name":"Multica","url":"https://archestack.com/api/v1/projects/best-of-ai/multica.json","page":"https://archestack.com/best-of-ai/projects/multica/","place":5,"score":72,"tagline":"Issue board where AI coding agents take assignments like teammates","source_url":"https://archestack.com/best-of-ai/projects/multica/","checked_at":"2026-10-15"}]},{"id":"automation","title":"Workflow automation with AI","url":"https://archestack.com/api/v1/categories/best-of-ai/automation.json","top":[{"id":"best-of-ai/n8n","name":"n8n","url":"https://archestack.com/api/v1/projects/best-of-ai/n8n.json","page":"https://archestack.com/best-of-ai/projects/n8n/","place":1,"score":77,"tagline":"Visual workflow automation with code steps, AI agent nodes and 1500+ integrations","source_url":"https://archestack.com/best-of-ai/projects/n8n/","checked_at":"2026-10-15"},{"id":"best-of-ai/activepieces","name":"Activepieces","url":"https://archestack.com/api/v1/projects/best-of-ai/activepieces.json","page":"https://archestack.com/best-of-ai/projects/activepieces/","place":2,"score":64,"tagline":"Self-hosted workflow automation with TypeScript integrations, alternative to Zapier","source_url":"https://archestack.com/best-of-ai/projects/activepieces/","checked_at":"2026-10-15"}]},{"id":"rag-knowledge","title":"RAG and knowledge","url":"https://archestack.com/api/v1/categories/best-of-ai/rag-knowledge.json","top":[{"id":"best-of-ai/deeptutor","name":"deeptutor","url":"https://archestack.com/api/v1/projects/best-of-ai/deeptutor.json","page":"https://archestack.com/best-of-ai/projects/deeptutor/","place":1,"score":78,"tagline":"Self-hosted AI tutor with knowledge bases, guided learning, books and quizzes","source_url":"https://archestack.com/best-of-ai/projects/deeptutor/","checked_at":"2026-10-15"},{"id":"best-of-ai/ragflow","name":"RAGFlow","url":"https://archestack.com/api/v1/projects/best-of-ai/ragflow.json","page":"https://arch